{
  "$schema": "./owner-sentence-corrections.schema.json",
  "registry": "rounds-owner-sentence-corrections",
  "description": "The templated \"<label> is the only command or contract owner\" sentence in 101 filed bodies, rewritten to name the DR-0002 rows and the owning leaf. #17 (ROUNDS-01-L03) carries these into the owner's re-authorization; no issue body is edited here.",
  "matrixRevision": 1,
  "entries": [
    {
      "issue": 1,
      "leaf": "ROUNDS-00A-L01",
      "label": "Execution and Rendering Platform",
      "kind": "owner",
      "original": "- Execution and Rendering Platform is the only command or contract owner for \"authentication, authorization, and quota enforcement for execution and render routes\"; callers cannot write durable state around it.",
      "rows": ["execution-admission"],
      "corrected": "- #1 (ROUNDS-00A-L01) is the command owner of `execution-admission` in DR-0002@1 (Execution Control Plane); callers cannot write durable state around it."
    },
    {
      "issue": 8,
      "leaf": "ROUNDS-00A-L08",
      "label": "Execution and Rendering Platform",
      "kind": "none",
      "original": "- Execution and Rendering Platform is the only command or contract owner for \"adversarial execution and rendering conformance suites\"; callers cannot write durable state around it.",
      "rows": [],
      "corrected": "- #8 (ROUNDS-00A-L08) owns no row in DR-0002@1: its suites test the rows #1, #2, and #3 own. It writes only through the commands of the rows it uses."
    },
    {
      "issue": 9,
      "leaf": "ROUNDS-00B-L01",
      "label": "Identity, Authorization, and Sharing",
      "kind": "none",
      "original": "- Identity, Authorization, and Sharing is the only command or contract owner for \"server-derived account-scope invariant\"; callers cannot write durable state around it.",
      "rows": [],
      "corrected": "- #9 (ROUNDS-00B-L01) owns no row in DR-0002@1: the account-scope invariant applies to every account-scoped row, and #172 (ROUNDS-34-L03) registers each row's authorization in the authz column. It writes only through the commands of the rows it uses."
    },
    {
      "issue": 10,
      "leaf": "ROUNDS-00B-L02",
      "label": "Identity, Authorization, and Sharing",
      "kind": "none",
      "original": "- Identity, Authorization, and Sharing is the only command or contract owner for \"authorization for typed relations and merges\"; callers cannot write durable state around it.",
      "rows": [],
      "corrected": "- #10 (ROUNDS-00B-L02) owns no row in DR-0002@1: it authorizes the relation and merge commands of `typed-relation`, `organization`, and `person`. It writes only through the commands of the rows it uses."
    },
    {
      "issue": 11,
      "leaf": "ROUNDS-00B-L03",
      "label": "Identity, Authorization, and Sharing",
      "kind": "owner",
      "original": "- Identity, Authorization, and Sharing is the only command or contract owner for \"immutable artifact share capabilities\"; callers cannot write durable state around it.",
      "rows": ["share-capability-metadata"],
      "corrected": "- #11 (ROUNDS-00B-L03) is the command owner of `share-capability-metadata` in DR-0002@1 (Public Share Capability Service); callers cannot write durable state around it."
    },
    {
      "issue": 12,
      "leaf": "ROUNDS-00B-L04",
      "label": "Identity, Authorization, and Sharing",
      "kind": "owner",
      "original": "- Identity, Authorization, and Sharing is the only command or contract owner for \"one-time share secret delivery, password protection, and rotation\"; callers cannot write durable state around it.",
      "rows": ["share-bearer-digest"],
      "corrected": "- #12 (ROUNDS-00B-L04) is the command owner of `share-bearer-digest` in DR-0002@1 (Public Share Capability Service); callers cannot write durable state around it."
    },
    {
      "issue": 13,
      "leaf": "ROUNDS-00B-L05",
      "label": "Identity, Authorization, and Sharing",
      "kind": "none",
      "original": "- Identity, Authorization, and Sharing is the only command or contract owner for \"complete two-account IDOR and disclosure suite\"; callers cannot write durable state around it.",
      "rows": [],
      "corrected": "- #13 (ROUNDS-00B-L05) owns no row in DR-0002@1: its suite tests every row's two-account isolation. It writes only through the commands of the rows it uses."
    },
    {
      "issue": 19,
      "leaf": "ROUNDS-02-L02",
      "label": "Domain Platform",
      "kind": "none",
      "original": "- Domain Platform is the only command or contract owner for \"account-authorized domain command gateway\"; callers cannot write durable state around it.",
      "rows": [],
      "corrected": "- #19 (ROUNDS-02-L02) owns no row in DR-0002@1: it owns command dispatch and the command registry; each command type belongs to the one row that lists it. It writes only through the commands of the rows it uses."
    },
    {
      "issue": 20,
      "leaf": "ROUNDS-02-L03",
      "label": "Domain Platform",
      "kind": "owner",
      "original": "- Domain Platform is the only command or contract owner for \"expected versions, idempotency, and conflict results\"; callers cannot write durable state around it.",
      "rows": ["idempotency-record"],
      "corrected": "- #20 (ROUNDS-02-L03) is the command owner of `idempotency-record` in DR-0002@1 (Transaction-owning Command Gateway); callers cannot write durable state around it."
    },
    {
      "issue": 21,
      "leaf": "ROUNDS-02-L04",
      "label": "Domain Platform",
      "kind": "owner",
      "original": "- Domain Platform is the only command or contract owner for \"transactional change sets, revisions, and audit entries\"; callers cannot write durable state around it.",
      "rows": ["audit-entry-change-set"],
      "corrected": "- #21 (ROUNDS-02-L04) is the command owner of `audit-entry-change-set` in DR-0002@1 (Revision and Audit Service); callers cannot write durable state around it."
    },
    {
      "issue": 22,
      "leaf": "ROUNDS-02-L05",
      "label": "Domain Platform",
      "kind": "owner",
      "original": "- Domain Platform is the only command or contract owner for \"domain events through a transactional outbox\"; callers cannot write durable state around it.",
      "rows": ["domain-event"],
      "corrected": "- #22 (ROUNDS-02-L05) is the command owner of `domain-event` in DR-0002@1 (Revision and Audit Service); callers cannot write durable state around it."
    },
    {
      "issue": 23,
      "leaf": "ROUNDS-02-L06",
      "label": "Domain Platform",
      "kind": "none",
      "original": "- Domain Platform is the only command or contract owner for \"checkpointed projectors and consistency envelopes\"; callers cannot write durable state around it.",
      "rows": [],
      "corrected": "- #23 (ROUNDS-02-L06) owns no row in DR-0002@1: it owns the checkpoint and envelope contract that every read-model row's projection uses. It writes only through the commands of the rows it uses."
    },
    {
      "issue": 24,
      "leaf": "ROUNDS-03-L01",
      "label": "Identity and Career Profile",
      "kind": "owner",
      "original": "- Identity and Career Profile is the only command or contract owner for \"Account and Career Profile aggregate contracts\"; callers cannot write durable state around it.",
      "rows": ["authentication-identity","professional-identity","profile-contact-point"],
      "corrected": "- #24 (ROUNDS-03-L01) is the command owner of `authentication-identity`, `professional-identity`, `profile-contact-point` in DR-0002@1 (Account Service, Career Profile Service); callers cannot write durable state around it."
    },
    {
      "issue": 27,
      "leaf": "ROUNDS-04-L01",
      "label": "Directory",
      "kind": "owner",
      "original": "- Directory is the only command or contract owner for \"Organization and Person aggregates\"; callers cannot write durable state around it.",
      "rows": ["organization","person","person-contact-point"],
      "corrected": "- #27 (ROUNDS-04-L01) is the command owner of `organization`, `person`, `person-contact-point` in DR-0002@1 (Identity Directory for Organization and Person); callers cannot write durable state around it."
    },
    {
      "issue": 28,
      "leaf": "ROUNDS-04-L02",
      "label": "Directory",
      "kind": "adds",
      "original": "- Directory is the only command or contract owner for \"identity resolution and duplicate-candidate scoring\"; callers cannot write durable state around it.",
      "rows": ["organization","person"],
      "corrected": "- #28 (ROUNDS-04-L02) adds identity resolution and duplicate-candidate scoring on `organization`, `person` in DR-0002@1 (Identity Directory for Organization and Person), whose command owner is #27 (ROUNDS-04-L01); callers cannot write durable state around it."
    },
    {
      "issue": 29,
      "leaf": "ROUNDS-04-L03",
      "label": "Directory",
      "kind": "adds",
      "original": "- Directory is the only command or contract owner for \"merge redirects, correction history, and privacy tombstones\"; callers cannot write durable state around it.",
      "rows": ["organization","person"],
      "corrected": "- #29 (ROUNDS-04-L03) adds merge, correction, and privacy-tombstone commands on `organization`, `person` in DR-0002@1 (Identity Directory for Organization and Person), whose command owner is #27 (ROUNDS-04-L01); callers cannot write durable state around it."
    },
    {
      "issue": 31,
      "leaf": "ROUNDS-05-L01",
      "label": "Career Profile",
      "kind": "owner",
      "original": "- Career Profile is the only command or contract owner for \"career history, education, and publication contracts\"; callers cannot write durable state around it.",
      "rows": ["employment-facts","education","publication"],